{
  "name": "sailing-curriculum",
  "owner": "ZenterFlow",
  "description": "Complete RYA/ASA YachtMaster Offshore navigation curriculum with 14 specialized tutor agents",
  "version": "0.1.0",
  "plugins": [
    {
      "name": "chart-basics",
      "source": "./01-chart-basics",
      "description": "Chart datum, symbols, Mercator projection, compass types, variation & deviation",
      "version": "0.1.0",
      "author": {
        "name": "ZenterFlow"
      },
      "keywords": ["sailing", "navigation", "charts", "datum", "compass"],
      "category": "navigation"
    },
    {
      "name": "tides",
      "source": "./02-tides",
      "description": "Causes, terms, tables, curves, secondary ports, diamonds, stream atlas",
      "version": "0.1.0",
      "author": {
        "name": "ZenterFlow"
      },
      "keywords": ["sailing", "navigation", "tides", "tidal-streams", "safety"],
      "category": "navigation"
    },
    {
      "name": "positioning",
      "source": "./03-positioning",
      "description": "EP, circle of error, visual fixing, leeway, cross-track error",
      "version": "0.1.0",
      "author": {
        "name": "ZenterFlow"
      },
      "keywords": ["sailing", "navigation", "positioning", "gps"],
      "category": "navigation"
    },
    {
      "name": "course-to-steer",
      "source": "./04-course-to-steer",
      "description": "CTS calculations, leeway application, worked examples",
      "version": "0.1.0",
      "author": {
        "name": "ZenterFlow"
      },
      "keywords": ["sailing", "navigation", "course", "leeway"],
      "category": "navigation"
    },
    {
      "name": "electronic-navigation",
      "source": "./05-electronic-navigation",
      "description": "GPS/GNSS, radar, instruments, abbreviations, Q & A",
      "version": "0.1.0",
      "author": {
        "name": "ZenterFlow"
      },
      "keywords": ["sailing", "navigation", "gps", "radar", "electronics"],
      "category": "navigation"
    },
    {
      "name": "ec-plotting",
      "source": "./06-ec-plotting",
      "description": "Chart-plotter operation, self-test questions",
      "version": "0.1.0",
      "author": {
        "name": "ZenterFlow"
      },
      "keywords": ["sailing", "navigation", "chartplotter", "electronic-charts"],
      "category": "navigation"
    },
    {
      "name": "passage-making",
      "source": "./07-passage-making",
      "description": "Planning, regulations, watch systems, monitoring, worked plans",
      "version": "0.1.0",
      "author": {
        "name": "ZenterFlow"
      },
      "keywords": ["sailing", "navigation", "passage-planning", "offshore"],
      "category": "navigation"
    },
    {
      "name": "visual-aids",
      "source": "./08-visual-aids",
      "description": "Buoys, lights, ranges, transits, dipping distances",
      "version": "0.1.0",
      "author": {
        "name": "ZenterFlow"
      },
      "keywords": ["sailing", "navigation", "buoys", "lights", "iala"],
      "category": "navigation"
    },
    {
      "name": "pilotage",
      "source": "./09-pilotage",
      "description": "Leading lines, clearing bearings, restricted visibility plans",
      "version": "0.1.0",
      "author": {
        "name": "ZenterFlow"
      },
      "keywords": ["sailing", "navigation", "pilotage", "harbor-entry"],
      "category": "navigation"
    },
    {
      "name": "meteorology",
      "source": "./10-meteorology",
      "description": "Forecast sources, clouds, sea-breeze, fog, synoptic charts",
      "version": "0.1.0",
      "author": {
        "name": "ZenterFlow"
      },
      "keywords": ["sailing", "weather", "meteorology", "forecasting"],
      "category": "weather"
    },
    {
      "name": "irpcs",
      "source": "./11-irpcs",
      "description": "General rules, sounds, day-shapes, lights, collision scenarios",
      "version": "0.1.0",
      "author": {
        "name": "ZenterFlow"
      },
      "keywords": ["sailing", "colregs", "irpcs", "collision-regulations"],
      "category": "regulations"
    },
    {
      "name": "safety-environment",
      "source": "./12-safety-environment",
      "description": "Safety briefs, Mayday, stability, environment regs",
      "version": "0.1.0",
      "author": {
        "name": "ZenterFlow"
      },
      "keywords": ["sailing", "safety", "mayday", "marpol"],
      "category": "safety"
    },
    {
      "name": "collision-regs",
      "source": "./13-collision-regs",
      "description": "Conduct in sight / restricted visibility, lights, sounds, exceptions",
      "version": "0.1.0",
      "author": {
        "name": "ZenterFlow"
      },
      "keywords": ["sailing", "colregs", "collision-avoidance", "visibility"],
      "category": "regulations"
    },
    {
      "name": "nav-lights-flip",
      "source": "./14-nav-lights-flip",
      "description": "Navigation lights, day shapes, flags, sound signals quick quiz",
      "version": "0.1.0",
      "author": {
        "name": "ZenterFlow"
      },
      "keywords": ["sailing", "lights", "shapes", "quiz", "colregs"],
      "category": "education"
    }
  ]
}
